Sheet: Video 2 Descalzo
F1: Tiempo | G1: x | H1: y | I1: x | J1: y | K1: x | L1: y
A2: Key Images | F2: =R[12]C[-3]-1300 -> 0 | G2: =R[12]C[-6]*-1 -> 40.270000000000003 | H2: =R[12]C[-6] -> 11.01 | I2: =R[68]C[-8]*-1 -> 29.31 | J2: =R[68]C[-8] -> 62.34 | K2: =R[124]C[-10]*-1 -> 5.43 | L2: =R[124]C[-10] -> 110.58
A3: Name | B3: Time | F3: =R[12]C[-3]-1300 -> 33 | G3: =R[12]C[-6]*-1 -> 41.29 | H3: =R[12]C[-6] -> 10.33 | I3: =R[68]C[-8]*-1 -> 31.9 | J3: =R[68]C[-8] -> 61.66 | K3: =R[124]C[-10]*-1 -> 8.23 | L3: =R[124]C[-10] -> 109.59
A4: 0 ms | B4: 0 | F4: =R[12]C[-3]-1300 -> 67 | G4: =R[12]C[-6]*-1 -> 42.82 | H4: =R[12]C[-6] -> 10.34 | I4: =R[68]C[-8]*-1 -> 35.21 | J4: =R[68]C[-8] -> 61.3 | K4: =R[124]C[-10]*-1 -> 12.5 | L4: =R[124]C[-10] -> 111.15
F5: =R[12]C[-3]-1300 -> 100 | G5: =R[12]C[-6]*-1 -> 44.19 | H5: =R[12]C[-6] -> 10.34 | I5: =R[68]C[-8]*-1 -> 38.89 | J5: =R[68]C[-8] -> 61.65 | K5: =R[124]C[-10]*-1 -> 15.67 | L5: =R[124]C[-10] -> 111.55
A6: Lines | F6: =R[12]C[-3]-1300 -> 133 | G6: =R[12]C[-6]*-1 -> 45.21 | H6: =R[12]C[-6] -> 10.34 | I6: =R[68]C[-8]*-1 -> 41.38 | J6: =R[68]C[-8] -> 62.05 | K6: =R[124]C[-10]*-1 -> 19 | L6: =R[124]C[-10] -> 113.06
A7: Name | B7: Length (cm) | C7: Time | F7: =R[12]C[-3]-1300 -> 167 | G7: =R[12]C[-6]*-1 -> 46.74 | H7: =R[12]C[-6] -> 10 | I7: =R[68]C[-8]*-1 -> 43.6 | J7: =R[68]C[-8] -> 62.06 | K7: =R[124]C[-10]*-1 -> 21.58 | L7: =R[124]C[-10] -> 113.09
A8: Línea 1 | B8: 180 | C8: 0 | F8: =R[12]C[-3]-1300 -> 200 | G8: =R[12]C[-6]*-1 -> 47.08 | H8: =R[12]C[-6] -> 9.32 | I8: =R[68]C[-8]*-1 -> 45.81 | J8: =R[68]C[-8] -> 62.06 | K8: =R[124]C[-10]*-1 -> 26.73 | L8: =R[124]C[-10] -> 113.39
F9: =R[12]C[-3]-1300 -> 233 | G9: =R[12]C[-6]*-1 -> 47.42 | H9: =R[12]C[-6] -> 9.32 | I9: =R[68]C[-8]*-1 -> 48.02 | J9: =R[68]C[-8] -> 61.72 | K9: =R[124]C[-10]*-1 -> 30.78 | L9: =R[124]C[-10] -> 114.16
A10: Track | F10: =R[12]C[-3]-1300 -> 267 | G10: =R[12]C[-6]*-1 -> 47.42 | H10: =R[12]C[-6] -> 9.33 | I10: =R[68]C[-8]*-1 -> 50.24 | J10: =R[68]C[-8] -> 61.39 | K10: =R[124]C[-10]*-1 -> 33.659999999999997 | L10: =R[124]C[-10] -> 115.4
A11: Label : | B11: Tobillo | F11: =R[12]C[-3]-1300 -> 300 | G11: =R[12]C[-6]*-1 -> 46.74 | H11: =R[12]C[-6] -> 9.32 | I11: =R[68]C[-8]*-1 -> 51.6 | J11: =R[68]C[-8] -> 61.39 | K11: =R[124]C[-10]*-1 -> 37.340000000000003 | L11: =R[124]C[-10] -> 115.35
A12: Coords (x,y:cm; t:time) | F12: =R[12]C[-3]-1300 -> 333 | G12: =R[12]C[-6]*-1 -> 46.74 | H12: =R[12]C[-6] -> 9.32 | I12: =R[68]C[-8]*-1 -> 53.08 | J12: =R[68]C[-8] -> 61.03 | K12: =R[124]C[-10]*-1 -> 39.549999999999997 | L12: =R[124]C[-10] -> 116.04
A13: x | B13: y | C13: t | F13: =R[12]C[-3]-1300 -> 367 | G13: =R[12]C[-6]*-1 -> 46.74 | H13: =R[12]C[-6] -> 9.32 | I13: =R[68]C[-8]*-1 -> 53.65 | J13: =R[68]C[-8] -> 60.71 | K13: =R[124]C[-10]*-1 -> 41.77 | L13: =R[124]C[-10] -> 116.38
A14: -40.270000000000003 | B14: 11.01 | C14: 1300 | F14: =R[12]C[-3]-1300 -> 400 | G14: =R[12]C[-6]*-1 -> 46.74 | H14: =R[12]C[-6] -> 9.32 | I14: =R[68]C[-8]*-1 -> 54.3 | J14: =R[68]C[-8] -> 60.34 | K14: =R[124]C[-10]*-1 -> 45.45 | L14: =R[124]C[-10] -> 115.26
A15: -41.29 | B15: 10.33 | C15: 1333 | F15: =R[12]C[-3]-1300 -> 433 | G15: =R[12]C[-6]*-1 -> 46.74 | H15: =R[12]C[-6] -> 8.98 | I15: =R[68]C[-8]*-1 -> 54.97 | J15: =R[68]C[-8] -> 59.66 | K15: =R[124]C[-10]*-1 -> 48.99 | L15: =R[124]C[-10] -> 115.56
A16: -42.82 | B16: 10.34 | C16: 1367 | F16: =R[12]C[-3]-1300 -> 467 | G16: =R[12]C[-6]*-1 -> 46.4 | H16: =R[12]C[-6] -> 8.98 | I16: =R[68]C[-8]*-1 -> 55.65 | J16: =R[68]C[-8] -> 59.29 | K16: =R[124]C[-10]*-1 -> 51.2 | L16: =R[124]C[-10] -> 116.24
A17: -44.19 | B17: 10.34 | C17: 1400 | F17: =R[12]C[-3]-1300 -> 500 | G17: =R[12]C[-6]*-1 -> 46.06 | H17: =R[12]C[-6] -> 8.98 | I17: =R[68]C[-8]*-1 -> 55.6 | J17: =R[68]C[-8] -> 59.31 | K17: =R[124]C[-10]*-1 -> 53.41 | L17: =R[124]C[-10] -> 116.25
A18: -45.21 | B18: 10.34 | C18: 1433 | F18: =R[12]C[-3]-1300 -> 533 | G18: =R[12]C[-6]*-1 -> 46.06 | H18: =R[12]C[-6] -> 8.98 | I18: =R[68]C[-8]*-1 -> 56.26 | J18: =R[68]C[-8] -> 59.33 | K18: =R[124]C[-10]*-1 -> 56.36 | L18: =R[124]C[-10] -> 115.14
A19: -46.74 | B19: 10 | C19: 1467 | F19: =R[12]C[-3]-1300 -> 567 | G19: =R[12]C[-6]*-1 -> 46.06 | H19: =R[12]C[-6] -> 8.98 | I19: =R[68]C[-8]*-1 -> 56.98 | J19: =R[68]C[-8] -> 58.99 | K19: =R[124]C[-10]*-1 -> 60.04 | L19: =R[124]C[-10] -> 115.83
A20: -47.08 | B20: 9.32 | C20: 1500 | F20: =R[12]C[-3]-1300 -> 600 | G20: =R[12]C[-6]*-1 -> 46.4 | H20: =R[12]C[-6] -> 8.98 | I20: =R[68]C[-8]*-1 -> 58.7 | J20: =R[68]C[-8] -> 58 | K20: =R[124]C[-10]*-1 -> 62.26 | L20: =R[124]C[-10] -> 116.17
A21: -47.42 | B21: 9.32 | C21: 1533 | F21: =R[12]C[-3]-1300 -> 633 | G21: =R[12]C[-6]*-1 -> 46.4 | H21: =R[12]C[-6] -> 8.98 | I21: =R[68]C[-8]*-1 -> 60.75 | J21: =R[68]C[-8] -> 58.01 | K21: =R[124]C[-10]*-1 -> 64.47 | L21: =R[124]C[-10] -> 117.2
A22: -47.42 | B22: 9.33 | C22: 1567 | F22: =R[12]C[-3]-1300 -> 667 | G22: =R[12]C[-6]*-1 -> 46.4 | H22: =R[12]C[-6] -> 8.98 | I22: =R[68]C[-8]*-1 -> 62.96 | J22: =R[68]C[-8] -> 57.67 | K22: =R[124]C[-10]*-1 -> 65.59 | L22: =R[124]C[-10] -> 113.16
A23: -46.74 | B23: 9.32 | C23: 1600 | F23: =R[12]C[-3]-1300 -> 700 | G23: =R[12]C[-6]*-1 -> 46.74 | H23: =R[12]C[-6] -> 9.32 | I23: =R[68]C[-8]*-1 -> 65 | J23: =R[68]C[-8] -> 57 | K23: =R[124]C[-10]*-1 -> 67.81 | L23: =R[124]C[-10] -> 112.84
A24: -46.74 | B24: 9.32 | C24: 1633 | F24: =R[12]C[-3]-1300 -> 733 | G24: =R[12]C[-6]*-1 -> 47.42 | H24: =R[12]C[-6] -> 9.66 | I24: =R[68]C[-8]*-1 -> 67.05 | J24: =R[68]C[-8] -> 56.32 | K24: =R[124]C[-10]*-1 -> 70.02 | L24: =R[124]C[-10] -> 112.16
A25: -46.74 | B25: 9.32 | C25: 1667 | F25: =R[12]C[-3]-1300 -> 767 | G25: =R[12]C[-6]*-1 -> 47.42 | H25: =R[12]C[-6] -> 10 | I25: =R[68]C[-8]*-1 -> 69.260000000000005 | J25: =R[68]C[-8] -> 55.98 | K25: =R[124]C[-10]*-1 -> 75.17 | L25: =R[124]C[-10] -> 111.9
A26: -46.74 | B26: 9.32 | C26: 1700 | F26: =R[12]C[-3]-1300 -> 800 | G26: =R[12]C[-6]*-1 -> 48.44 | H26: =R[12]C[-6] -> 10.35 | I26: =R[68]C[-8]*-1 -> 71.48 | J26: =R[68]C[-8] -> 55.31 | K26: =R[124]C[-10]*-1 -> 79.959999999999994 | L26: =R[124]C[-10] -> 112.72
A27: -46.74 | B27: 8.98 | C27: 1733 | F27: =R[12]C[-3]-1300 -> 833 | G27: =R[12]C[-6]*-1 -> 49.46 | H27: =R[12]C[-6] -> 11.03 | I27: =R[68]C[-8]*-1 -> 73.69 | J27: =R[68]C[-8] -> 54.97 | K27: =R[124]C[-10]*-1 -> 84.01 | L27: =R[124]C[-10] -> 110.92
A28: -46.4 | B28: 8.98 | C28: 1767 | F28: =R[12]C[-3]-1300 -> 867 | G28: =R[12]C[-6]*-1 -> 50.14 | H28: =R[12]C[-6] -> 12.39 | I28: =R[68]C[-8]*-1 -> 76.89 | J28: =R[68]C[-8] -> 55.74 | K28: =R[124]C[-10]*-1 -> 87.7 | L28: =R[124]C[-10] -> 110.61
A29: -46.06 | B29: 8.98 | C29: 1800 | F29: =R[12]C[-3]-1300 -> 900 | G29: =R[12]C[-6]*-1 -> 51.15 | H29: =R[12]C[-6] -> 14.27 | I29: =R[68]C[-8]*-1 -> 81.67 | J29: =R[68]C[-8] -> 55.78 | K29: =R[124]C[-10]*-1 -> 91.75 | L29: =R[124]C[-10] -> 110.94
A30: -46.06 | B30: 8.98 | C30: 1833 | F30: =R[12]C[-3]-1300 -> 933 | G30: =R[12]C[-6]*-1 -> 52.51 | H30: =R[12]C[-6] -> 16.14 | I30: =R[68]C[-8]*-1 -> 86.83 | J30: =R[68]C[-8] -> 55.44 | K30: =R[124]C[-10]*-1 -> 93.96 | L30: =R[124]C[-10] -> 111.28
A31: -46.06 | B31: 8.98 | C31: 1867 | F31: =R[12]C[-3]-1300 -> 967 | G31: =R[12]C[-6]*-1 -> 56.8 | H31: =R[12]C[-6] -> 20.16 | I31: =R[68]C[-8]*-1 -> 93.08 | J31: =R[68]C[-8] -> 55.54 | K31: =R[124]C[-10]*-1 -> 99.48 | L31: =R[124]C[-10] -> 111.69
A32: -46.4 | B32: 8.98 | C32: 1900 | F32: =R[12]C[-3]-1300 -> 1000 | G32: =R[12]C[-6]*-1 -> 61.27 | H32: =R[12]C[-6] -> 22.37 | I32: =R[68]C[-8]*-1 -> 100.81 | J32: =R[68]C[-8] -> 55.88 | K32: =R[124]C[-10]*-1 -> 100.5 | L32: =R[124]C[-10] -> 112.37
A33: -46.4 | B33: 8.98 | C33: 1933 | F33: =R[12]C[-3]-1300 -> 1033 | G33: =R[12]C[-6]*-1 -> 67.95 | H33: =R[12]C[-6] -> 24.58 | I33: =R[68]C[-8]*-1 -> 108.17 | J33: =R[68]C[-8] -> 56.23 | K33: =R[124]C[-10]*-1 -> 105.3 | L33: =R[124]C[-10] -> 112.06
A34: -46.4 | B34: 8.98 | C34: 1967 | F34: =R[12]C[-3]-1300 -> 1067 | G34: =R[12]C[-6]*-1 -> 74.63 | H34: =R[12]C[-6] -> 26.41 | I34: =R[68]C[-8]*-1 -> 116.62 | J34: =R[68]C[-8] -> 57.31 | K34: =R[124]C[-10]*-1 -> 107.51 | L34: =R[124]C[-10] -> 112.41
A35: -46.74 | B35: 9.32 | C35: 2000 | F35: =R[12]C[-3]-1300 -> 1100 | G35: =R[12]C[-6]*-1 -> 80.88 | H35: =R[12]C[-6] -> 26.43 | I35: =R[68]C[-8]*-1 -> 123.25 | J35: =R[68]C[-8] -> 58.51 | K35: =R[124]C[-10]*-1 -> 111.19 | L35: =R[124]C[-10] -> 112.81
A36: -47.42 | B36: 9.66 | C36: 2033 | F36: =R[12]C[-3]-1300 -> 1133 | G36: =R[12]C[-6]*-1 -> 89.33 | H36: =R[12]C[-6] -> 25.34 | I36: =R[68]C[-8]*-1 -> 129.87 | J36: =R[68]C[-8] -> 61.51 | K36: =R[124]C[-10]*-1 -> 113.4 | L36: =R[124]C[-10] -> 113.5
A37: -47.42 | B37: 10 | C37: 2067 | F37: =R[12]C[-3]-1300 -> 1167 | G37: =R[12]C[-6]*-1 -> 96.31 | H37: =R[12]C[-6] -> 23.52 | I37: =R[68]C[-8]*-1 -> 135.02000000000001 | J37: =R[68]C[-8] -> 62 | K37: =R[124]C[-10]*-1 -> 115.44 | L37: =R[124]C[-10] -> 113.84
A38: -48.44 | B38: 10.35 | C38: 2100 | F38: =R[12]C[-3]-1300 -> 1200 | G38: =R[12]C[-6]*-1 -> 106.23 | H38: =R[12]C[-6] -> 20.6 | I38: =R[68]C[-8]*-1 -> 139.81 | J38: =R[68]C[-8] -> 63.47 | K38: =R[124]C[-10]*-1 -> 119.86 | L38: =R[124]C[-10] -> 114.56
A39: -49.46 | B39: 11.03 | C39: 2133 | F39: =R[12]C[-3]-1300 -> 1233 | G39: =R[12]C[-6]*-1 -> 115.42 | H39: =R[12]C[-6] -> 17.68 | I39: =R[68]C[-8]*-1 -> 144.22999999999999 | J39: =R[68]C[-8] -> 64.56 | K39: =R[124]C[-10]*-1 -> 122.44 | L39: =R[124]C[-10] -> 114.56
A40: -50.14 | B40: 12.39 | C40: 2167 | F40: =R[12]C[-3]-1300 -> 1267 | G40: =R[12]C[-6]*-1 -> 126.45 | H40: =R[12]C[-6] -> 14.03 | I40: =R[68]C[-8]*-1 -> 146.44 | J40: =R[68]C[-8] -> 65.58 | K40: =R[124]C[-10]*-1 -> 124.48 | L40: =R[124]C[-10] -> 114.91
A41: -51.15 | B41: 14.27 | C41: 2200 | F41: =R[12]C[-3]-1300 -> 1300 | G41: =R[12]C[-6]*-1 -> 134.54 | H41: =R[12]C[-6] -> 11.47 | I41: =R[68]C[-8]*-1 -> 148.65 | J41: =R[68]C[-8] -> 65.92 | K41: =R[124]C[-10]*-1 -> 126.7 | L41: =R[124]C[-10] -> 114.92
A42: -52.51 | B42: 16.14 | C42: 2233 | F42: =R[12]C[-3]-1300 -> 1333 | G42: =R[12]C[-6]*-1 -> 143.27000000000001 | H42: =R[12]C[-6] -> 9.98 | I42: =R[68]C[-8]*-1 -> 150.87 | J42: =R[68]C[-8] -> 65.930000000000007 | K42: =R[124]C[-10]*-1 -> 128.91 | L42: =R[124]C[-10] -> 114.92
A43: -56.8 | B43: 20.16 | C43: 2267 | F43: =R[12]C[-3]-1300 -> 1367 | G43: =R[12]C[-6]*-1 -> 152.08000000000001 | H43: =R[12]C[-6] -> 10 | I43: =R[68]C[-8]*-1 -> 153.08000000000001 | J43: =R[68]C[-8] -> 65.25 | K43: =R[124]C[-10]*-1 -> 131.12 | L43: =R[124]C[-10] -> 114.93
A44: -61.27 | B44: 22.37 | C44: 2300 | F44: =R[12]C[-3]-1300 -> 1400 | G44: =R[12]C[-6]*-1 -> 158.69999999999999 | H44: =R[12]C[-6] -> 9.2799999999999994 | I44: =R[68]C[-8]*-1 -> 155.29 | J44: =R[68]C[-8] -> 64.58 | K44: =R[124]C[-10]*-1 -> 133.56 | L44: =R[124]C[-10] -> 115.07
A45: -67.95 | B45: 24.58 | C45: 2333 | F45: =R[12]C[-3]-1300 -> 1433 | G45: =R[12]C[-6]*-1 -> 163.92 | H45: =R[12]C[-6] -> 7.81 | I45: =R[68]C[-8]*-1 -> 157 | J45: =R[68]C[-8] -> 63.9 | K45: =R[124]C[-10]*-1 -> 137.25 | L45: =R[124]C[-10] -> 114
A46: -74.63 | B46: 26.41 | C46: 2367 | F46: =R[12]C[-3]-1300 -> 1467 | G46: =R[12]C[-6]*-1 -> 167.29 | H46: =R[12]C[-6] -> 7.85 | I46: =R[68]C[-8]*-1 -> 158.69999999999999 | J46: =R[68]C[-8] -> 63.56 | K46: =R[124]C[-10]*-1 -> 139.46 | L46: =R[124]C[-10] -> 114
A47: -80.88 | B47: 26.43 | C47: 2400 | F47: =R[12]C[-3]-1300 -> 1500 | G47: =R[12]C[-6]*-1 -> 168.82 | H47: =R[12]C[-6] -> 7.17 | I47: =R[68]C[-8]*-1 -> 160.74 | J47: =R[68]C[-8] -> 63.23 | K47: =R[124]C[-10]*-1 -> 142.77000000000001 | L47: =R[124]C[-10] -> 113.75
A48: -89.33 | B48: 25.34 | C48: 2433 | F48: =R[12]C[-3]-1300 -> 1533 | G48: =R[12]C[-6]*-1 -> 169.16 | H48: =R[12]C[-6] -> 6.83 | I48: =R[68]C[-8]*-1 -> 162.79 | J48: =R[68]C[-8] -> 62.55 | K48: =R[124]C[-10]*-1 -> 144.99 | L48: =R[124]C[-10] -> 113.78
A49: -96.31 | B49: 23.52 | C49: 2467 | F49: =R[12]C[-3]-1300 -> 1567 | G49: =R[12]C[-6]*-1 -> 170.52 | H49: =R[12]C[-6] -> 6.83 | I49: =R[68]C[-8]*-1 -> 165 | J49: =R[68]C[-8] -> 62.21 | K49: =R[124]C[-10]*-1 -> 149.41 | L49: =R[124]C[-10] -> 113.81
A50: -106.23 | B50: 20.6 | C50: 2500 | F50: =R[12]C[-3]-1300 -> 1600 | G50: =R[12]C[-6]*-1 -> 172.06 | H50: =R[12]C[-6] -> 6.83 | I50: =R[68]C[-8]*-1 -> 167.21 | J50: =R[68]C[-8] -> 62.21 | K50: =R[124]C[-10]*-1 -> 151.62 | L50: =R[124]C[-10] -> 114.16
A51: -115.42 | B51: 17.68 | C51: 2533 | F51: =R[12]C[-3]-1300 -> 1633 | G51: =R[12]C[-6]*-1 -> 175.79 | H51: =R[12]C[-6] -> 6.5 | I51: =R[68]C[-8]*-1 -> 169.43 | J51: =R[68]C[-8] -> 61.54 | K51: =R[124]C[-10]*-1 -> 154.94 | L51: =R[124]C[-10] -> 114.16
A52: -126.45 | B52: 14.03 | C52: 2567 | F52: =R[12]C[-3]-1300 -> 1667 | G52: =R[12]C[-6]*-1 -> 176.81 | H52: =R[12]C[-6] -> 6.5 | I52: =R[68]C[-8]*-1 -> 171.65 | J52: =R[68]C[-8] -> 61.2 | K52: =R[124]C[-10]*-1 -> 157.15 | L52: =R[124]C[-10] -> 114.85
A53: -134.54 | B53: 11.47 | C53: 2600
A54: -143.27000000000001 | B54: 9.98 | C54: 2633
A55: -152.08000000000001 | B55: 10 | C55: 2667
A56: -158.69999999999999 | B56: 9.2799999999999994 | C56: 2700
A57: -163.92 | B57: 7.81 | C57: 2733
A58: -167.29 | B58: 7.85 | C58: 2767
A59: -168.82 | B59: 7.17 | C59: 2800
A60: -169.16 | B60: 6.83 | C60: 2833
A61: -170.52 | B61: 6.83 | C61: 2867
A62: -172.06 | B62: 6.83 | C62: 2900
A63: -175.79 | B63: 6.5 | C63: 2933
A64: -176.81 | B64: 6.5 | C64: 2967
A66: Track
A67: Label : | B67: Rodilla
A68: Coords (x,y:cm; t:time)
A69: x | B69: y | C69: t
A70: -29.31 | B70: 62.34 | C70: 1300
A71: -31.9 | B71: 61.66 | C71: 1333
A72: -35.21 | B72: 61.3 | C72: 1367
A73: -38.89 | B73: 61.65 | C73: 1400
A74: -41.38 | B74: 62.05 | C74: 1433
A75: -43.6 | B75: 62.06 | C75: 1467
A76: -45.81 | B76: 62.06 | C76: 1500
A77: -48.02 | B77: 61.72 | C77: 1533
A78: -50.24 | B78: 61.39 | C78: 1567
A79: -51.6 | B79: 61.39 | C79: 1600
A80: -53.08 | B80: 61.03 | C80: 1633
A81: -53.65 | B81: 60.71 | C81: 1667
A82: -54.3 | B82: 60.34 | C82: 1700
A83: -54.97 | B83: 59.66 | C83: 1733
A84: -55.65 | B84: 59.29 | C84: 1767
A85: -55.6 | B85: 59.31 | C85: 1800
A86: -56.26 | B86: 59.33 | C86: 1833
A87: -56.98 | B87: 58.99 | C87: 1867
A88: -58.7 | B88: 58 | C88: 1900
A89: -60.75 | B89: 58.01 | C89: 1933
A90: -62.96 | B90: 57.67 | C90: 1967
A91: -65 | B91: 57 | C91: 2000
A92: -67.05 | B92: 56.32 | C92: 2033
A93: -69.260000000000005 | B93: 55.98 | C93: 2067
A94: -71.48 | B94: 55.31 | C94: 2100
A95: -73.69 | B95: 54.97 | C95: 2133
A96: -76.89 | B96: 55.74 | C96: 2167
A97: -81.67 | B97: 55.78 | C97: 2200
A98: -86.83 | B98: 55.44 | C98: 2233
A99: -93.08 | B99: 55.54 | C99: 2267
A100: -100.81 | B100: 55.88 | C100: 2300
A101: -108.17 | B101: 56.23 | C101: 2333
A102: -116.62 | B102: 57.31 | C102: 2367
A103: -123.25 | B103: 58.51 | C103: 2400
A104: -129.87 | B104: 61.51 | C104: 2433
A105: -135.02000000000001 | B105: 62 | C105: 2467
A106: -139.81 | B106: 63.47 | C106: 2500
A107: -144.22999999999999 | B107: 64.56 | C107: 2533
A108: -146.44 | B108: 65.58 | C108: 2567
A109: -148.65 | B109: 65.92 | C109: 2600
A110: -150.87 | B110: 65.930000000000007 | C110: 2633
A111: -153.08000000000001 | B111: 65.25 | C111: 2667
A112: -155.29 | B112: 64.58 | C112: 2700
A113: -157 | B113: 63.9 | C113: 2733
A114: -158.69999999999999 | B114: 63.56 | C114: 2767
A115: -160.74 | B115: 63.23 | C115: 2800
A116: -162.79 | B116: 62.55 | C116: 2833
A117: -165 | B117: 62.21 | C117: 2867
A118: -167.21 | B118: 62.21 | C118: 2900
A119: -169.43 | B119: 61.54 | C119: 2933
A120: -171.65 | B120: 61.2 | C120: 2967
A122: Track
A123: Label : | B123: Cadera
A124: Coords (x,y:cm; t:time)
A125: x | B125: y | C125: t
A126: -5.43 | B126: 110.58 | C126: 1300
A127: -8.23 | B127: 109.59 | C127: 1333
A128: -12.5 | B128: 111.15 | C128: 1367
A129: -15.67 | B129: 111.55 | C129: 1400
A130: -19 | B130: 113.06 | C130: 1433
A131: -21.58 | B131: 113.09 | C131: 1467
A132: -26.73 | B132: 113.39 | C132: 1500
A133: -30.78 | B133: 114.16 | C133: 1533
A134: -33.659999999999997 | B134: 115.4 | C134: 1567
A135: -37.340000000000003 | B135: 115.35 | C135: 1600
A136: -39.549999999999997 | B136: 116.04 | C136: 1633
A137: -41.77 | B137: 116.38 | C137: 1667
A138: -45.45 | B138: 115.26 | C138: 1700
A139: -48.99 | B139: 115.56 | C139: 1733
A140: -51.2 | B140: 116.24 | C140: 1767
A141: -53.41 | B141: 116.25 | C141: 1800
A142: -56.36 | B142: 115.14 | C142: 1833
A143: -60.04 | B143: 115.83 | C143: 1867
A144: -62.26 | B144: 116.17 | C144: 1900
A145: -64.47 | B145: 117.2 | C145: 1933
A146: -65.59 | B146: 113.16 | C146: 1967
A147: -67.81 | B147: 112.84 | C147: 2000
A148: -70.02 | B148: 112.16 | C148: 2033
A149: -75.17 | B149: 111.9 | C149: 2067
A150: -79.959999999999994 | B150: 112.72 | C150: 2100
A151: -84.01 | B151: 110.92 | C151: 2133
A152: -87.7 | B152: 110.61 | C152: 2167
A153: -91.75 | B153: 110.94 | C153: 2200
A154: -93.96 | B154: 111.28 | C154: 2233
A155: -99.48 | B155: 111.69 | C155: 2267
A156: -100.5 | B156: 112.37 | C156: 2300
A157: -105.3 | B157: 112.06 | C157: 2333
A158: -107.51 | B158: 112.41 | C158: 2367
A159: -111.19 | B159: 112.81 | C159: 2400
A160: -113.4 | B160: 113.5 | C160: 2433
A161: -115.44 | B161: 113.84 | C161: 2467
A162: -119.86 | B162: 114.56 | C162: 2500
A163: -122.44 | B163: 114.56 | C163: 2533
A164: -124.48 | B164: 114.91 | C164: 2567
A165: -126.7 | B165: 114.92 | C165: 2600
A166: -128.91 | B166: 114.92 | C166: 2633
A167: -131.12 | B167: 114.93 | C167: 2667
A168: -133.56 | B168: 115.07 | C168: 2700
A169: -137.25 | B169: 114 | C169: 2733
A170: -139.46 | B170: 114 | C170: 2767
A171: -142.77000000000001 | B171: 113.75 | C171: 2800
A172: -144.99 | B172: 113.78 | C172: 2833
A173: -149.41 | B173: 113.81 | C173: 2867
A174: -151.62 | B174: 114.16 | C174: 2900
A175: -154.94 | B175: 114.16 | C175: 2933
A176: -157.15 | B176: 114.85 | C176: 2967