Sheet: Video 1 Descalzo
F1: Tiempo | G1: x | H1: y | I1: x | J1: y | K1: x | L1: y
A2: Key Images | F2: =R[12]C[-3]-1233 -> 0 | G2: =R[12]C[-6]*-1 -> 45.19 | H2: =R[12]C[-6] -> 10 | I2: =R[74]C[-8]*-1 -> 34.700000000000003 | J2: =R[74]C[-8] -> 59.95 | K2: =R[136]C[-10]*-1 -> 13.16 | L2: =R[136]C[-10] -> 107.55
A3: Name | B3: Time | F3: =R[12]C[-3]-1233 -> 34 | G3: =R[12]C[-6]*-1 -> 46.04 | H3: =R[12]C[-6] -> 10.34 | I3: =R[74]C[-8]*-1 -> 38.07 | J3: =R[74]C[-8] -> 59.97 | K3: =R[136]C[-10]*-1 -> 16.079999999999998 | L3: =R[136]C[-10] -> 107.55
A4: 0 ms | B4: 0 | F4: =R[12]C[-3]-1233 -> 67 | G4: =R[12]C[-6]*-1 -> 48.39 | H4: =R[12]C[-6] -> 10.74 | I4: =R[74]C[-8]*-1 -> 41.81 | J4: =R[74]C[-8] -> 60.31 | K4: =R[136]C[-10]*-1 -> 19.739999999999998 | L4: =R[136]C[-10] -> 108.27
F5: =R[12]C[-3]-1233 -> 100 | G5: =R[12]C[-6]*-1 -> 49.25 | H5: =R[12]C[-6] -> 11.08 | I5: =R[74]C[-8]*-1 -> 45.92 | J5: =R[74]C[-8] -> 60.68 | K5: =R[136]C[-10]*-1 -> 22.66 | L5: =R[136]C[-10] -> 108.61
A6: Lines | F6: =R[12]C[-3]-1233 -> 134 | G6: =R[12]C[-6]*-1 -> 50.11 | H6: =R[12]C[-6] -> 10.39 | I6: =R[74]C[-8]*-1 -> 47.81 | J6: =R[74]C[-8] -> 60.34 | K6: =R[136]C[-10]*-1 -> 25.57 | L6: =R[136]C[-10] -> 108.61
A7: Name | B7: Length (cm) | C7: Time | F7: =R[12]C[-3]-1233 -> 167 | G7: =R[12]C[-6]*-1 -> 50.97 | H7: =R[12]C[-6] -> 10.15 | I7: =R[74]C[-8]*-1 -> 50.81 | J7: =R[74]C[-8] -> 60.34 | K7: =R[136]C[-10]*-1 -> 29.6 | L7: =R[136]C[-10] -> 110.54
A8: Línea 1 | B8: 180 | C8: 0 | F8: =R[12]C[-3]-1233 -> 200 | G8: =R[12]C[-6]*-1 -> 51.65 | H8: =R[12]C[-6] -> 10.15 | I8: =R[74]C[-8]*-1 -> 53.81 | J8: =R[74]C[-8] -> 60 | K8: =R[136]C[-10]*-1 -> 33.630000000000003 | L8: =R[136]C[-10] -> 110.86
F9: =R[12]C[-3]-1233 -> 234 | G9: =R[12]C[-6]*-1 -> 50.79 | H9: =R[12]C[-6] -> 10.5 | I9: =R[74]C[-8]*-1 -> 56.44 | J9: =R[74]C[-8] -> 59.28 | K9: =R[136]C[-10]*-1 -> 36.549999999999997 | L9: =R[136]C[-10] -> 111.55
A10: Track | F10: =R[12]C[-3]-1233 -> 267 | G10: =R[12]C[-6]*-1 -> 51.88 | H10: =R[12]C[-6] -> 10.119999999999999 | I10: =R[74]C[-8]*-1 -> 59.81 | J10: =R[74]C[-8] -> 59.28 | K10: =R[136]C[-10]*-1 -> 40.58 | L10: =R[136]C[-10] -> 111.52
A11: Label : | B11: Tobillo | F11: =R[12]C[-3]-1233 -> 300 | G11: =R[12]C[-6]*-1 -> 51.88 | H11: =R[12]C[-6] -> 10.119999999999999 | I11: =R[74]C[-8]*-1 -> 61.7 | J11: =R[74]C[-8] -> 58.94 | K11: =R[136]C[-10]*-1 -> 43.5 | L11: =R[136]C[-10] -> 111.86
A12: Coords (x,y:cm; t:time) | F12: =R[12]C[-3]-1233 -> 334 | G12: =R[12]C[-6]*-1 -> 51.88 | H12: =R[12]C[-6] -> 9.7799999999999994 | I12: =R[74]C[-8]*-1 -> 63.07 | J12: =R[74]C[-8] -> 58.59 | K12: =R[136]C[-10]*-1 -> 46.41 | L12: =R[136]C[-10] -> 112.2
A13: x | B13: y | C13: t | F13: =R[12]C[-3]-1233 -> 367 | G13: =R[12]C[-6]*-1 -> 51.88 | H13: =R[12]C[-6] -> 9.7799999999999994 | I13: =R[74]C[-8]*-1 -> 63.85 | J13: =R[74]C[-8] -> 58.25 | K13: =R[136]C[-10]*-1 -> 49.33 | L13: =R[136]C[-10] -> 112.2
A14: -45.19 | B14: 10 | C14: 1233 | F14: =R[12]C[-3]-1233 -> 400 | G14: =R[12]C[-6]*-1 -> 51.88 | H14: =R[12]C[-6] -> 9.7799999999999994 | I14: =R[74]C[-8]*-1 -> 64.459999999999994 | J14: =R[74]C[-8] -> 57.52 | K14: =R[136]C[-10]*-1 -> 52.25 | L14: =R[136]C[-10] -> 112.55
A15: -46.04 | B15: 10.34 | C15: 1267 | F15: =R[12]C[-3]-1233 -> 434 | G15: =R[12]C[-6]*-1 -> 51.88 | H15: =R[12]C[-6] -> 9.7799999999999994 | I15: =R[74]C[-8]*-1 -> 65.540000000000006 | J15: =R[74]C[-8] -> 57.13 | K15: =R[136]C[-10]*-1 -> 55.17 | L15: =R[136]C[-10] -> 112.54
A16: -48.39 | B16: 10.74 | C16: 1300 | F16: =R[12]C[-3]-1233 -> 467 | G16: =R[12]C[-6]*-1 -> 51.54 | H16: =R[12]C[-6] -> 9.7799999999999994 | I16: =R[74]C[-8]*-1 -> 66.23 | J16: =R[74]C[-8] -> 56.44 | K16: =R[136]C[-10]*-1 -> 57.91 | L16: =R[136]C[-10] -> 112.89
A17: -49.25 | B17: 11.08 | C17: 1333 | F17: =R[12]C[-3]-1233 -> 500 | G17: =R[12]C[-6]*-1 -> 51.54 | H17: =R[12]C[-6] -> 9.7799999999999994 | I17: =R[74]C[-8]*-1 -> 66.569999999999993 | J17: =R[74]C[-8] -> 56.1 | K17: =R[136]C[-10]*-1 -> 60.83 | L17: =R[136]C[-10] -> 112.89
A18: -50.11 | B18: 10.39 | C18: 1367 | F18: =R[12]C[-3]-1233 -> 534 | G18: =R[12]C[-6]*-1 -> 51.54 | H18: =R[12]C[-6] -> 9.7799999999999994 | I18: =R[74]C[-8]*-1 -> 66.91 | J18: =R[74]C[-8] -> 55.76 | K18: =R[136]C[-10]*-1 -> 63.75 | L18: =R[136]C[-10] -> 112.2
A19: -50.97 | B19: 10.15 | C19: 1400 | F19: =R[12]C[-3]-1233 -> 567 | G19: =R[12]C[-6]*-1 -> 51.54 | H19: =R[12]C[-6] -> 10.119999999999999 | I19: =R[74]C[-8]*-1 -> 67.25 | J19: =R[74]C[-8] -> 55.76 | K19: =R[136]C[-10]*-1 -> 66.67 | L19: =R[136]C[-10] -> 111.51
A20: -51.65 | B20: 10.15 | C20: 1433 | F20: =R[12]C[-3]-1233 -> 600 | G20: =R[12]C[-6]*-1 -> 51.54 | H20: =R[12]C[-6] -> 10.119999999999999 | I20: =R[74]C[-8]*-1 -> 67.94 | J20: =R[74]C[-8] -> 55.76 | K20: =R[136]C[-10]*-1 -> 69.59 | L20: =R[136]C[-10] -> 111.17
A21: -50.79 | B21: 10.5 | C21: 1467 | F21: =R[12]C[-3]-1233 -> 634 | G21: =R[12]C[-6]*-1 -> 51.54 | H21: =R[12]C[-6] -> 10.46 | I21: =R[74]C[-8]*-1 -> 68.97 | J21: =R[74]C[-8] -> 55.75 | K21: =R[136]C[-10]*-1 -> 72.510000000000005 | L21: =R[136]C[-10] -> 110.49
A22: -51.88 | B22: 10.119999999999999 | C22: 1500 | F22: =R[12]C[-3]-1233 -> 667 | G22: =R[12]C[-6]*-1 -> 51.2 | H22: =R[12]C[-6] -> 10.46 | I22: =R[74]C[-8]*-1 -> 70 | J22: =R[74]C[-8] -> 55.41 | K22: =R[136]C[-10]*-1 -> 75.430000000000007 | L22: =R[136]C[-10] -> 109.8
A23: -51.88 | B23: 10.119999999999999 | C23: 1533 | F23: =R[12]C[-3]-1233 -> 700 | G23: =R[12]C[-6]*-1 -> 51.54 | H23: =R[12]C[-6] -> 10.81 | I23: =R[74]C[-8]*-1 -> 70.37 | J23: =R[74]C[-8] -> 56.63 | K23: =R[136]C[-10]*-1 -> 78.349999999999994 | L23: =R[136]C[-10] -> 109.11
A24: -51.88 | B24: 9.7799999999999994 | C24: 1567 | F24: =R[12]C[-3]-1233 -> 734 | G24: =R[12]C[-6]*-1 -> 51.88 | H24: =R[12]C[-6] -> 11.15 | I24: =R[74]C[-8]*-1 -> 72.260000000000005 | J24: =R[74]C[-8] -> 56.29 | K24: =R[136]C[-10]*-1 -> 81.260000000000005 | L24: =R[136]C[-10] -> 108.77
A25: -51.88 | B25: 9.7799999999999994 | C25: 1600 | F25: =R[12]C[-3]-1233 -> 767 | G25: =R[12]C[-6]*-1 -> 52.22 | H25: =R[12]C[-6] -> 11.49 | I25: =R[74]C[-8]*-1 -> 74.150000000000006 | J25: =R[74]C[-8] -> 55.95 | K25: =R[136]C[-10]*-1 -> 84.18 | L25: =R[136]C[-10] -> 108.43
A26: -51.88 | B26: 9.7799999999999994 | C26: 1633 | F26: =R[12]C[-3]-1233 -> 800 | G26: =R[12]C[-6]*-1 -> 52.91 | H26: =R[12]C[-6] -> 11.84 | I26: =R[74]C[-8]*-1 -> 76.03 | J26: =R[74]C[-8] -> 55.6 | K26: =R[136]C[-10]*-1 -> 87.1 | L26: =R[136]C[-10] -> 109.11
A27: -51.88 | B27: 9.7799999999999994 | C27: 1667 | F27: =R[12]C[-3]-1233 -> 834 | G27: =R[12]C[-6]*-1 -> 53.77 | H27: =R[12]C[-6] -> 12.86 | I27: =R[74]C[-8]*-1 -> 80.150000000000006 | J27: =R[74]C[-8] -> 55.26 | K27: =R[136]C[-10]*-1 -> 90.02 | L27: =R[136]C[-10] -> 109.46
A28: -51.54 | B28: 9.7799999999999994 | C28: 1700 | F28: =R[12]C[-3]-1233 -> 867 | G28: =R[12]C[-6]*-1 -> 53.74 | H28: =R[12]C[-6] -> 15.35 | I28: =R[74]C[-8]*-1 -> 83.51 | J28: =R[74]C[-8] -> 54.91 | K28: =R[136]C[-10]*-1 -> 92.94 | L28: =R[136]C[-10] -> 108.77
A29: -51.54 | B29: 9.7799999999999994 | C29: 1733 | F29: =R[12]C[-3]-1233 -> 900 | G29: =R[12]C[-6]*-1 -> 56.83 | H29: =R[12]C[-6] -> 17.8 | I29: =R[74]C[-8]*-1 -> 88.74 | J29: =R[74]C[-8] -> 54.94 | K29: =R[136]C[-10]*-1 -> 97.34 | L29: =R[136]C[-10] -> 109.11
A30: -51.54 | B30: 9.7799999999999994 | C30: 1767 | F30: =R[12]C[-3]-1233 -> 934 | G30: =R[12]C[-6]*-1 -> 60.28 | H30: =R[12]C[-6] -> 19.93 | I30: =R[74]C[-8]*-1 -> 94.7 | J30: =R[74]C[-8] -> 54.65 | K30: =R[136]C[-10]*-1 -> 100.26 | L30: =R[136]C[-10] -> 109.8
A31: -51.54 | B31: 10.119999999999999 | C31: 1800 | F31: =R[12]C[-3]-1233 -> 967 | G31: =R[12]C[-6]*-1 -> 65.47 | H31: =R[12]C[-6] -> 21.79 | I31: =R[74]C[-8]*-1 -> 102.52 | J31: =R[74]C[-8] -> 55.35 | K31: =R[136]C[-10]*-1 -> 103.18 | L31: =R[136]C[-10] -> 110.14
A32: -51.54 | B32: 10.119999999999999 | C32: 1833 | F32: =R[12]C[-3]-1233 -> 1000 | G32: =R[12]C[-6]*-1 -> 70.28 | H32: =R[12]C[-6] -> 24.01 | I32: =R[74]C[-8]*-1 -> 109.97 | J32: =R[74]C[-8] -> 54.58 | K32: =R[136]C[-10]*-1 -> 107.95 | L32: =R[136]C[-10] -> 110.14
A33: -51.54 | B33: 10.46 | C33: 1867 | F33: =R[12]C[-3]-1233 -> 1034 | G33: =R[12]C[-6]*-1 -> 76.95 | H33: =R[12]C[-6] -> 24.75 | I33: =R[74]C[-8]*-1 -> 117.41 | J33: =R[74]C[-8] -> 55.8 | K33: =R[136]C[-10]*-1 -> 110.35 | L33: =R[136]C[-10] -> 111.17
A34: -51.2 | B34: 10.46 | C34: 1900 | F34: =R[12]C[-3]-1233 -> 1067 | G34: =R[12]C[-6]*-1 -> 83.62 | H34: =R[12]C[-6] -> 25.49 | I34: =R[74]C[-8]*-1 -> 123.75 | J34: =R[74]C[-8] -> 57.7 | K34: =R[136]C[-10]*-1 -> 114.29 | L34: =R[136]C[-10] -> 111.51
A35: -51.54 | B35: 10.81 | C35: 1933 | F35: =R[12]C[-3]-1233 -> 1100 | G35: =R[12]C[-6]*-1 -> 90.28 | H35: =R[12]C[-6] -> 25.86 | I35: =R[74]C[-8]*-1 -> 130.46 | J35: =R[74]C[-8] -> 59.15 | K35: =R[136]C[-10]*-1 -> 116.35 | L35: =R[136]C[-10] -> 112.2
A36: -51.88 | B36: 11.15 | C36: 1967 | F36: =R[12]C[-3]-1233 -> 1134 | G36: =R[12]C[-6]*-1 -> 97.69 | H36: =R[12]C[-6] -> 25.86 | I36: =R[74]C[-8]*-1 -> 136.79 | J36: =R[74]C[-8] -> 60.22 | K36: =R[136]C[-10]*-1 -> 119.1 | L36: =R[136]C[-10] -> 112.88
A37: -52.22 | B37: 11.49 | C37: 2000 | F37: =R[12]C[-3]-1233 -> 1167 | G37: =R[12]C[-6]*-1 -> 106.21 | H37: =R[12]C[-6] -> 22.9 | I37: =R[74]C[-8]*-1 -> 141.63999999999999 | J37: =R[74]C[-8] -> 62.04 | K37: =R[136]C[-10]*-1 -> 123.38 | L37: =R[136]C[-10] -> 112.08
A38: -52.91 | B38: 11.84 | C38: 2033 | F38: =R[12]C[-3]-1233 -> 1200 | G38: =R[12]C[-6]*-1 -> 114.36 | H38: =R[12]C[-6] -> 19.93 | I38: =R[74]C[-8]*-1 -> 146.5 | J38: =R[74]C[-8] -> 63.91 | K38: =R[136]C[-10]*-1 -> 125.78 | L38: =R[136]C[-10] -> 112.42
A39: -53.77 | B39: 12.86 | C39: 2067 | F39: =R[12]C[-3]-1233 -> 1234 | G39: =R[12]C[-6]*-1 -> 123.62 | H39: =R[12]C[-6] -> 15.12 | I39: =R[74]C[-8]*-1 -> 148.38999999999999 | J39: =R[74]C[-8] -> 64.59 | K39: =R[136]C[-10]*-1 -> 128.18 | L39: =R[136]C[-10] -> 112.42
A40: -53.74 | B40: 15.35 | C40: 2100 | F40: =R[12]C[-3]-1233 -> 1267 | G40: =R[12]C[-6]*-1 -> 134.72999999999999 | H40: =R[12]C[-6] -> 12.53 | I40: =R[74]C[-8]*-1 -> 152.15 | J40: =R[74]C[-8] -> 64.31 | K40: =R[136]C[-10]*-1 -> 130.58000000000001 | L40: =R[136]C[-10] -> 112.42
A41: -56.83 | B41: 17.8 | C41: 2133 | F41: =R[12]C[-3]-1233 -> 1300 | G41: =R[12]C[-6]*-1 -> 141.76 | H41: =R[12]C[-6] -> 10.31 | I41: =R[74]C[-8]*-1 -> 154.03 | J41: =R[74]C[-8] -> 64.31 | K41: =R[136]C[-10]*-1 -> 132.99 | L41: =R[136]C[-10] -> 112.42
A42: -60.28 | B42: 19.93 | C42: 2167 | F42: =R[12]C[-3]-1233 -> 1334 | G42: =R[12]C[-6]*-1 -> 150.28 | H42: =R[12]C[-6] -> 8.82 | I42: =R[74]C[-8]*-1 -> 155.91999999999999 | J42: =R[74]C[-8] -> 63.62 | K42: =R[136]C[-10]*-1 -> 135.72999999999999 | L42: =R[136]C[-10] -> 112.42
A43: -65.47 | B43: 21.79 | C43: 2200 | F43: =R[12]C[-3]-1233 -> 1367 | G43: =R[12]C[-6]*-1 -> 158.43 | H43: =R[12]C[-6] -> 8.4499999999999993 | I43: =R[74]C[-8]*-1 -> 157.81 | J43: =R[74]C[-8] -> 62.93 | K43: =R[136]C[-10]*-1 -> 138.13 | L43: =R[136]C[-10] -> 112.08
A44: -70.28 | B44: 24.01 | C44: 2233 | F44: =R[12]C[-3]-1233 -> 1400 | G44: =R[12]C[-6]*-1 -> 163.99 | H44: =R[12]C[-6] -> 8.08 | I44: =R[74]C[-8]*-1 -> 159.53 | J44: =R[74]C[-8] -> 62.25 | K44: =R[136]C[-10]*-1 -> 140.88 | L44: =R[136]C[-10] -> 111.74
A45: -76.95 | B45: 24.75 | C45: 2267 | F45: =R[12]C[-3]-1233 -> 1434 | G45: =R[12]C[-6]*-1 -> 168.06 | H45: =R[12]C[-6] -> 8.08 | I45: =R[74]C[-8]*-1 -> 160.9 | J45: =R[74]C[-8] -> 61.56 | K45: =R[136]C[-10]*-1 -> 143.63 | L45: =R[136]C[-10] -> 111.4
A46: -83.62 | B46: 25.49 | C46: 2300 | F46: =R[12]C[-3]-1233 -> 1467 | G46: =R[12]C[-6]*-1 -> 171.15 | H46: =R[12]C[-6] -> 7.33 | I46: =R[74]C[-8]*-1 -> 162.62 | J46: =R[74]C[-8] -> 60.87 | K46: =R[136]C[-10]*-1 -> 146.37 | L46: =R[136]C[-10] -> 111.4
A47: -90.28 | B47: 25.86 | C47: 2333 | F47: =R[12]C[-3]-1233 -> 1500 | G47: =R[12]C[-6]*-1 -> 173.87 | H47: =R[12]C[-6] -> 6.99 | I47: =R[74]C[-8]*-1 -> 164.5 | J47: =R[74]C[-8] -> 60.18 | K47: =R[136]C[-10]*-1 -> 149.12 | L47: =R[136]C[-10] -> 110.71
A48: -97.69 | B48: 25.86 | C48: 2367 | F48: =R[12]C[-3]-1233 -> 1534 | G48: =R[12]C[-6]*-1 -> 174.73 | H48: =R[12]C[-6] -> 6.64 | I48: =R[74]C[-8]*-1 -> 166.39 | J48: =R[74]C[-8] -> 58.47 | K48: =R[136]C[-10]*-1 -> 151.86000000000001 | L48: =R[136]C[-10] -> 110.37
A49: -106.21 | B49: 22.9 | C49: 2400 | F49: =R[12]C[-3]-1233 -> 1567 | G49: =R[12]C[-6]*-1 -> 175.59 | H49: =R[12]C[-6] -> 6.64 | I49: =R[74]C[-8]*-1 -> 168.28 | J49: =R[74]C[-8] -> 58.47 | K49: =R[136]C[-10]*-1 -> 154.78 | L49: =R[136]C[-10] -> 110.02
A50: -114.36 | B50: 19.93 | C50: 2433 | F50: =R[12]C[-3]-1233 -> 1600 | G50: =R[12]C[-6]*-1 -> 176.45 | H50: =R[12]C[-6] -> 6.64 | I50: =R[74]C[-8]*-1 -> 170.18 | J50: =R[74]C[-8] -> 58.47 | K50: =R[136]C[-10]*-1 -> 157.69999999999999 | L50: =R[136]C[-10] -> 110.71
A51: -123.62 | B51: 15.12 | C51: 2467 | F51: =R[12]C[-3]-1233 -> 1634 | G51: =R[12]C[-6]*-1 -> 177.31 | H51: =R[12]C[-6] -> 6.64 | I51: =R[74]C[-8]*-1 -> 172.08 | J51: =R[74]C[-8] -> 58.81 | K51: =R[136]C[-10]*-1 -> 160.62 | L51: =R[136]C[-10] -> 111.4
A52: -134.72999999999999 | B52: 12.53 | C52: 2500 | F52: =R[12]C[-3]-1233 -> 1667 | G52: =R[12]C[-6]*-1 -> 178.16 | H52: =R[12]C[-6] -> 6.64 | I52: =R[74]C[-8]*-1 -> 173.8 | J52: =R[74]C[-8] -> 59.16 | K52: =R[136]C[-10]*-1 -> 163.53 | L52: =R[136]C[-10] -> 112.08
A53: -141.76 | B53: 10.31 | C53: 2533 | F53: =R[12]C[-3]-1233 -> 1700 | G53: =R[12]C[-6]*-1 -> 178.85 | H53: =R[12]C[-6] -> 6.64 | I53: =R[74]C[-8]*-1 -> 174.84 | J53: =R[74]C[-8] -> 59.16 | K53: =R[136]C[-10]*-1 -> 166.45 | L53: =R[136]C[-10] -> 111.74
A54: -150.28 | B54: 8.82 | C54: 2567 | F54: =R[12]C[-3]-1233 -> 1734 | G54: =R[12]C[-6]*-1 -> 178.85 | H54: =R[12]C[-6] -> 6.64 | I54: =R[74]C[-8]*-1 -> 175.88 | J54: =R[74]C[-8] -> 59.49 | K54: =R[136]C[-10]*-1 -> 169.37 | L54: =R[136]C[-10] -> 112.43
A55: -158.43 | B55: 8.4499999999999993 | C55: 2600 | F55: =R[12]C[-3]-1233 -> 1767 | G55: =R[12]C[-6]*-1 -> 179.19 | H55: =R[12]C[-6] -> 6.64 | I55: =R[74]C[-8]*-1 -> 177.25 | J55: =R[74]C[-8] -> 59.49 | K55: =R[136]C[-10]*-1 -> 171.77 | L55: =R[136]C[-10] -> 112.77
A56: -163.99 | B56: 8.08 | C56: 2633 | F56: =R[12]C[-3]-1233 -> 1800 | G56: =R[12]C[-6]*-1 -> 179.19 | H56: =R[12]C[-6] -> 6.3 | I56: =R[74]C[-8]*-1 -> 178.27 | J56: =R[74]C[-8] -> 59.49 | K56: =R[136]C[-10]*-1 -> 173.83 | L56: =R[136]C[-10] -> 113.11
A57: -168.06 | B57: 8.08 | C57: 2667 | F57: =R[12]C[-3]-1233 -> 1834 | G57: =R[12]C[-6]*-1 -> 179.2 | H57: =R[12]C[-6] -> 6.3 | I57: =R[74]C[-8]*-1 -> 178.95 | J57: =R[74]C[-8] -> 58.8 | K57: =R[136]C[-10]*-1 -> 175.54 | L57: =R[136]C[-10] -> 113.11
A58: -171.15 | B58: 7.33 | C58: 2700 | F58: =R[12]C[-3]-1233 -> 1867 | G58: =R[12]C[-6]*-1 -> 179.54 | H58: =R[12]C[-6] -> 6.64 | I58: =R[74]C[-8]*-1 -> 179.64 | J58: =R[74]C[-8] -> 58.8 | K58: =R[136]C[-10]*-1 -> 177.26 | L58: =R[136]C[-10] -> 113.45
A59: -173.87 | B59: 6.99 | C59: 2733
A60: -174.73 | B60: 6.64 | C60: 2767
A61: -175.59 | B61: 6.64 | C61: 2800
A62: -176.45 | B62: 6.64 | C62: 2833
A63: -177.31 | B63: 6.64 | C63: 2867
A64: -178.16 | B64: 6.64 | C64: 2900
A65: -178.85 | B65: 6.64 | C65: 2933
A66: -178.85 | B66: 6.64 | C66: 2967
A67: -179.19 | B67: 6.64 | C67: 3000
A68: -179.19 | B68: 6.3 | C68: 3033
A69: -179.2 | B69: 6.3 | C69: 3067
A70: -179.54 | B70: 6.64 | C70: 3100
A72: Track
A73: Label : | B73: Rodilla
A74: Coords (x,y:cm; t:time)
A75: x | B75: y | C75: t
A76: -34.700000000000003 | B76: 59.95 | C76: 1233
A77: -38.07 | B77: 59.97 | C77: 1267
A78: -41.81 | B78: 60.31 | C78: 1300
A79: -45.92 | B79: 60.68 | C79: 1333
A80: -47.81 | B80: 60.34 | C80: 1367
A81: -50.81 | B81: 60.34 | C81: 1400
A82: -53.81 | B82: 60 | C82: 1433
A83: -56.44 | B83: 59.28 | C83: 1467
A84: -59.81 | B84: 59.28 | C84: 1500
A85: -61.7 | B85: 58.94 | C85: 1533
A86: -63.07 | B86: 58.59 | C86: 1567
A87: -63.85 | B87: 58.25 | C87: 1600
A88: -64.459999999999994 | B88: 57.52 | C88: 1633
A89: -65.540000000000006 | B89: 57.13 | C89: 1667
A90: -66.23 | B90: 56.44 | C90: 1700
A91: -66.569999999999993 | B91: 56.1 | C91: 1733
A92: -66.91 | B92: 55.76 | C92: 1767
A93: -67.25 | B93: 55.76 | C93: 1800
A94: -67.94 | B94: 55.76 | C94: 1833
A95: -68.97 | B95: 55.75 | C95: 1867
A96: -70 | B96: 55.41 | C96: 1900
A97: -70.37 | B97: 56.63 | C97: 1933
A98: -72.260000000000005 | B98: 56.29 | C98: 1967
A99: -74.150000000000006 | B99: 55.95 | C99: 2000
A100: -76.03 | B100: 55.6 | C100: 2033
A101: -80.150000000000006 | B101: 55.26 | C101: 2067
A102: -83.51 | B102: 54.91 | C102: 2100
A103: -88.74 | B103: 54.94 | C103: 2133
A104: -94.7 | B104: 54.65 | C104: 2167
A105: -102.52 | B105: 55.35 | C105: 2200
A106: -109.97 | B106: 54.58 | C106: 2233
A107: -117.41 | B107: 55.8 | C107: 2267
A108: -123.75 | B108: 57.7 | C108: 2300
A109: -130.46 | B109: 59.15 | C109: 2333
A110: -136.79 | B110: 60.22 | C110: 2367
A111: -141.63999999999999 | B111: 62.04 | C111: 2400
A112: -146.5 | B112: 63.91 | C112: 2433
A113: -148.38999999999999 | B113: 64.59 | C113: 2467
A114: -152.15 | B114: 64.31 | C114: 2500
A115: -154.03 | B115: 64.31 | C115: 2533
A116: -155.91999999999999 | B116: 63.62 | C116: 2567
A117: -157.81 | B117: 62.93 | C117: 2600
A118: -159.53 | B118: 62.25 | C118: 2633
A119: -160.9 | B119: 61.56 | C119: 2667
A120: -162.62 | B120: 60.87 | C120: 2700
A121: -164.5 | B121: 60.18 | C121: 2733
A122: -166.39 | B122: 58.47 | C122: 2767
A123: -168.28 | B123: 58.47 | C123: 2800
A124: -170.18 | B124: 58.47 | C124: 2833
A125: -172.08 | B125: 58.81 | C125: 2867
A126: -173.8 | B126: 59.16 | C126: 2900
A127: -174.84 | B127: 59.16 | C127: 2933
A128: -175.88 | B128: 59.49 | C128: 2967
A129: -177.25 | B129: 59.49 | C129: 3000
A130: -178.27 | B130: 59.49 | C130: 3033
A131: -178.95 | B131: 58.8 | C131: 3067
A132: -179.64 | B132: 58.8 | C132: 3100
A134: Track
A135: Label : | B135: Cadera
A136: Coords (x,y:cm; t:time)
A137: x | B137: y | C137: t
A138: -13.16 | B138: 107.55 | C138: 1233
A139: -16.079999999999998 | B139: 107.55 | C139: 1267
A140: -19.739999999999998 | B140: 108.27 | C140: 1300
A141: -22.66 | B141: 108.61 | C141: 1333
A142: -25.57 | B142: 108.61 | C142: 1367
A143: -29.6 | B143: 110.54 | C143: 1400
A144: -33.630000000000003 | B144: 110.86 | C144: 1433
A145: -36.549999999999997 | B145: 111.55 | C145: 1467
A146: -40.58 | B146: 111.52 | C146: 1500
A147: -43.5 | B147: 111.86 | C147: 1533
A148: -46.41 | B148: 112.2 | C148: 1567
A149: -49.33 | B149: 112.2 | C149: 1600
A150: -52.25 | B150: 112.55 | C150: 1633
A151: -55.17 | B151: 112.54 | C151: 1667
A152: -57.91 | B152: 112.89 | C152: 1700
A153: -60.83 | B153: 112.89 | C153: 1733
A154: -63.75 | B154: 112.2 | C154: 1767
A155: -66.67 | B155: 111.51 | C155: 1800
A156: -69.59 | B156: 111.17 | C156: 1833
A157: -72.510000000000005 | B157: 110.49 | C157: 1867
A158: -75.430000000000007 | B158: 109.8 | C158: 1900
A159: -78.349999999999994 | B159: 109.11 | C159: 1933
A160: -81.260000000000005 | B160: 108.77 | C160: 1967
A161: -84.18 | B161: 108.43 | C161: 2000
A162: -87.1 | B162: 109.11 | C162: 2033
A163: -90.02 | B163: 109.46 | C163: 2067
A164: -92.94 | B164: 108.77 | C164: 2100
A165: -97.34 | B165: 109.11 | C165: 2133
A166: -100.26 | B166: 109.8 | C166: 2167
A167: -103.18 | B167: 110.14 | C167: 2200
A168: -107.95 | B168: 110.14 | C168: 2233
A169: -110.35 | B169: 111.17 | C169: 2267
A170: -114.29 | B170: 111.51 | C170: 2300
A171: -116.35 | B171: 112.2 | C171: 2333
A172: -119.1 | B172: 112.88 | C172: 2367
A173: -123.38 | B173: 112.08 | C173: 2400
A174: -125.78 | B174: 112.42 | C174: 2433
A175: -128.18 | B175: 112.42 | C175: 2467
A176: -130.58000000000001 | B176: 112.42 | C176: 2500
A177: -132.99 | B177: 112.42 | C177: 2533
A178: -135.72999999999999 | B178: 112.42 | C178: 2567
A179: -138.13 | B179: 112.08 | C179: 2600
A180: -140.88 | B180: 111.74 | C180: 2633
A181: -143.63 | B181: 111.4 | C181: 2667
A182: -146.37 | B182: 111.4 | C182: 2700
A183: -149.12 | B183: 110.71 | C183: 2733
A184: -151.86000000000001 | B184: 110.37 | C184: 2767
A185: -154.78 | B185: 110.02 | C185: 2800
A186: -157.69999999999999 | B186: 110.71 | C186: 2833
A187: -160.62 | B187: 111.4 | C187: 2867
A188: -163.53 | B188: 112.08 | C188: 2900
A189: -166.45 | B189: 111.74 | C189: 2933
A190: -169.37 | B190: 112.43 | C190: 2967
A191: -171.77 | B191: 112.77 | C191: 3000
A192: -173.83 | B192: 113.11 | C192: 3033
A193: -175.54 | B193: 113.11 | C193: 3067
A194: -177.26 | B194: 113.45 | C194: 3100