Sheet: Video 3 Descalzo
F1: Tiempo | G1: x | H1: y | I1: x | J1: y | K1: x | L1: y
A2: Key Images | F2: =R[12]C[-3]-1033 -> 0 | G2: =R[12]C[-6]*-1 -> 36.619999999999997 | H2: =R[12]C[-6] -> 11.97 | I2: =R[75]C[-8]*-1 -> 24.13 | J2: =R[75]C[-8] -> 61.42 | K2: =R[138]C[-10]*-1 -> 4.3099999999999996 | L2: =R[138]C[-10] -> 108.74
A3: Name | B3: Time | F3: =R[12]C[-3]-1033 -> 34 | G3: =R[12]C[-6]*-1 -> 38.32 | H3: =R[12]C[-6] -> 11.62 | I3: =R[75]C[-8]*-1 -> 26.73 | J3: =R[75]C[-8] -> 61.09 | K3: =R[138]C[-10]*-1 -> 6.04 | L3: =R[138]C[-10] -> 109.49
A4: 0 ms | B4: 0 | F4: =R[12]C[-3]-1033 -> 67 | G4: =R[12]C[-6]*-1 -> 39.68 | H4: =R[12]C[-6] -> 11.28 | I4: =R[75]C[-8]*-1 -> 28.61 | J4: =R[75]C[-8] -> 61.09 | K4: =R[138]C[-10]*-1 -> 8.9499999999999993 | L4: =R[138]C[-10] -> 111.03
F5: =R[12]C[-3]-1033 -> 100 | G5: =R[12]C[-6]*-1 -> 39.68 | H5: =R[12]C[-6] -> 11.28 | I5: =R[75]C[-8]*-1 -> 29.63 | J5: =R[75]C[-8] -> 61.08 | K5: =R[138]C[-10]*-1 -> 8.9499999999999993 | L5: =R[138]C[-10] -> 111.37
A6: Lines | F6: =R[12]C[-3]-1033 -> 134 | G6: =R[12]C[-6]*-1 -> 40.700000000000003 | H6: =R[12]C[-6] -> 10.94 | I6: =R[75]C[-8]*-1 -> 33.340000000000003 | J6: =R[75]C[-8] -> 61.78 | K6: =R[138]C[-10]*-1 -> 12.96 | L6: =R[138]C[-10] -> 111.8
A7: Name | B7: Length (cm) | C7: Time | F7: =R[12]C[-3]-1033 -> 167 | G7: =R[12]C[-6]*-1 -> 41.38 | H7: =R[12]C[-6] -> 10.93 | I7: =R[75]C[-8]*-1 -> 35.21 | J7: =R[75]C[-8] -> 61.43 | K7: =R[138]C[-10]*-1 -> 16.53 | L7: =R[138]C[-10] -> 112.23
A8: Línea 1 | B8: 180 | C8: 0 | F8: =R[12]C[-3]-1033 -> 200 | G8: =R[12]C[-6]*-1 -> 42.06 | H8: =R[12]C[-6] -> 10.59 | I8: =R[75]C[-8]*-1 -> 37.44 | J8: =R[75]C[-8] -> 61.92 | K8: =R[138]C[-10]*-1 -> 19.59 | L8: =R[138]C[-10] -> 114.48
F9: =R[12]C[-3]-1033 -> 234 | G9: =R[12]C[-6]*-1 -> 43.08 | H9: =R[12]C[-6] -> 10.24 | I9: =R[75]C[-8]*-1 -> 39.14 | J9: =R[75]C[-8] -> 61.57 | K9: =R[138]C[-10]*-1 -> 23.6 | L9: =R[138]C[-10] -> 114.55
A10: Track | F10: =R[12]C[-3]-1033 -> 267 | G10: =R[12]C[-6]*-1 -> 42.29 | H10: =R[12]C[-6] -> 10.33 | I10: =R[75]C[-8]*-1 -> 41.02 | J10: =R[75]C[-8] -> 61.56 | K10: =R[138]C[-10]*-1 -> 26.61 | L10: =R[138]C[-10] -> 115.2
A11: Label : | B11: Tobillo | F11: =R[12]C[-3]-1033 -> 300 | G11: =R[12]C[-6]*-1 -> 42.3 | H11: =R[12]C[-6] -> 10.67 | I11: =R[75]C[-8]*-1 -> 42.04 | J11: =R[75]C[-8] -> 61.22 | K11: =R[138]C[-10]*-1 -> 29.21 | L11: =R[138]C[-10] -> 115.98
A12: Coords (x,y:cm; t:time) | F12: =R[12]C[-3]-1033 -> 334 | G12: =R[12]C[-6]*-1 -> 41.55 | H12: =R[12]C[-6] -> 9.91 | I12: =R[75]C[-8]*-1 -> 43.74 | J12: =R[75]C[-8] -> 61.21 | K12: =R[138]C[-10]*-1 -> 32.15 | L12: =R[138]C[-10] -> 116.36
A13: x | B13: y | C13: t | F13: =R[12]C[-3]-1033 -> 367 | G13: =R[12]C[-6]*-1 -> 41.55 | H13: =R[12]C[-6] -> 9.9 | I13: =R[75]C[-8]*-1 -> 44.76 | J13: =R[75]C[-8] -> 61.21 | K13: =R[138]C[-10]*-1 -> 34.75 | L13: =R[138]C[-10] -> 116.78
A14: -36.619999999999997 | B14: 11.97 | C14: 1033 | F14: =R[12]C[-3]-1033 -> 400 | G14: =R[12]C[-6]*-1 -> 41.55 | H14: =R[12]C[-6] -> 9.9 | I14: =R[75]C[-8]*-1 -> 46.28 | J14: =R[75]C[-8] -> 60.88 | K14: =R[138]C[-10]*-1 -> 37.380000000000003 | L14: =R[138]C[-10] -> 116.76
A15: -38.32 | B15: 11.62 | C15: 1067 | F15: =R[12]C[-3]-1033 -> 434 | G15: =R[12]C[-6]*-1 -> 41.55 | H15: =R[12]C[-6] -> 9.9 | I15: =R[75]C[-8]*-1 -> 47.31 | J15: =R[75]C[-8] -> 60.87 | K15: =R[138]C[-10]*-1 -> 39.65 | L15: =R[138]C[-10] -> 116.75
A16: -39.68 | B16: 11.28 | C16: 1100 | F16: =R[12]C[-3]-1033 -> 467 | G16: =R[12]C[-6]*-1 -> 41.89 | H16: =R[12]C[-6] -> 9.9 | I16: =R[75]C[-8]*-1 -> 48.67 | J16: =R[75]C[-8] -> 60.53 | K16: =R[138]C[-10]*-1 -> 43.02 | L16: =R[138]C[-10] -> 116.4
A17: -39.68 | B17: 11.28 | C17: 1133 | F17: =R[12]C[-3]-1033 -> 500 | G17: =R[12]C[-6]*-1 -> 41.89 | H17: =R[12]C[-6] -> 9.9 | I17: =R[75]C[-8]*-1 -> 48.95 | J17: =R[75]C[-8] -> 61.06 | K17: =R[138]C[-10]*-1 -> 44.55 | L17: =R[138]C[-10] -> 116.39
A18: -40.700000000000003 | B18: 10.94 | C18: 1167 | F18: =R[12]C[-3]-1033 -> 534 | G18: =R[12]C[-6]*-1 -> 42.23 | H18: =R[12]C[-6] -> 9.9 | I18: =R[75]C[-8]*-1 -> 50.31 | J18: =R[75]C[-8] -> 60.71 | K18: =R[138]C[-10]*-1 -> 47.55 | L18: =R[138]C[-10] -> 115.7
A19: -41.38 | B19: 10.93 | C19: 1200 | F19: =R[12]C[-3]-1033 -> 567 | G19: =R[12]C[-6]*-1 -> 42.23 | H19: =R[12]C[-6] -> 9.89 | I19: =R[75]C[-8]*-1 -> 51.68 | J19: =R[75]C[-8] -> 60.37 | K19: =R[138]C[-10]*-1 -> 50.18 | L19: =R[138]C[-10] -> 115.35
A20: -42.06 | B20: 10.59 | C20: 1233 | F20: =R[12]C[-3]-1033 -> 600 | G20: =R[12]C[-6]*-1 -> 42.23 | H20: =R[12]C[-6] -> 9.89 | I20: =R[75]C[-8]*-1 -> 53.04 | J20: =R[75]C[-8] -> 60.02 | K20: =R[138]C[-10]*-1 -> 53.55 | L20: =R[138]C[-10] -> 114.99
A21: -43.08 | B21: 10.24 | C21: 1267 | F21: =R[12]C[-3]-1033 -> 634 | G21: =R[12]C[-6]*-1 -> 42.91 | H21: =R[12]C[-6] -> 9.89 | I21: =R[75]C[-8]*-1 -> 54.4 | J21: =R[75]C[-8] -> 59.67 | K21: =R[138]C[-10]*-1 -> 55.08 | L21: =R[138]C[-10] -> 114.99
A22: -42.29 | B22: 10.33 | C22: 1300 | F22: =R[12]C[-3]-1033 -> 667 | G22: =R[12]C[-6]*-1 -> 43.26 | H22: =R[12]C[-6] -> 9.89 | I22: =R[75]C[-8]*-1 -> 56.1 | J22: =R[75]C[-8] -> 58.99 | K22: =R[138]C[-10]*-1 -> 57.54 | L22: =R[138]C[-10] -> 113.11
A23: -42.3 | B23: 10.67 | C23: 1333 | F23: =R[12]C[-3]-1033 -> 700 | G23: =R[12]C[-6]*-1 -> 43.59 | H23: =R[12]C[-6] -> 9.5399999999999991 | I23: =R[75]C[-8]*-1 -> 57.97 | J23: =R[75]C[-8] -> 58.64 | K23: =R[138]C[-10]*-1 -> 61.27 | L23: =R[138]C[-10] -> 112.76
A24: -41.55 | B24: 9.91 | C24: 1367 | F24: =R[12]C[-3]-1033 -> 734 | G24: =R[12]C[-6]*-1 -> 43.6 | H24: =R[12]C[-6] -> 9.5399999999999991 | I24: =R[75]C[-8]*-1 -> 59.84 | J24: =R[75]C[-8] -> 57.95 | K24: =R[138]C[-10]*-1 -> 64.64 | L24: =R[138]C[-10] -> 112.38
A25: -41.55 | B25: 9.9 | C25: 1400 | F25: =R[12]C[-3]-1033 -> 767 | G25: =R[12]C[-6]*-1 -> 43.6 | H25: =R[12]C[-6] -> 9.5500000000000007 | I25: =R[75]C[-8]*-1 -> 61.71 | J25: =R[75]C[-8] -> 57.26 | K25: =R[138]C[-10]*-1 -> 66.73 | L25: =R[138]C[-10] -> 112.03
A26: -41.55 | B26: 9.9 | C26: 1433 | F26: =R[12]C[-3]-1033 -> 800 | G26: =R[12]C[-6]*-1 -> 43.94 | H26: =R[12]C[-6] -> 9.8800000000000008 | I26: =R[75]C[-8]*-1 -> 63.58 | J26: =R[75]C[-8] -> 56.57 | K26: =R[138]C[-10]*-1 -> 70.099999999999994 | L26: =R[138]C[-10] -> 111.33
A27: -41.55 | B27: 9.9 | C27: 1467 | F27: =R[12]C[-3]-1033 -> 834 | G27: =R[12]C[-6]*-1 -> 44.28 | H27: =R[12]C[-6] -> 10.56 | I27: =R[75]C[-8]*-1 -> 65.45 | J27: =R[75]C[-8] -> 55.88 | K27: =R[138]C[-10]*-1 -> 73.459999999999994 | L27: =R[138]C[-10] -> 110.3
A28: -41.89 | B28: 9.9 | C28: 1500 | F28: =R[12]C[-3]-1033 -> 867 | G28: =R[12]C[-6]*-1 -> 44.62 | H28: =R[12]C[-6] -> 11.24 | I28: =R[75]C[-8]*-1 -> 69.16 | J28: =R[75]C[-8] -> 55.72 | K28: =R[138]C[-10]*-1 -> 76.459999999999994 | L28: =R[138]C[-10] -> 109.61
A29: -41.89 | B29: 9.9 | C29: 1533 | F29: =R[12]C[-3]-1033 -> 900 | G29: =R[12]C[-6]*-1 -> 46.81 | H29: =R[12]C[-6] -> 13.35 | I29: =R[75]C[-8]*-1 -> 71.03 | J29: =R[75]C[-8] -> 55.53 | K29: =R[138]C[-10]*-1 -> 80.2 | L29: =R[138]C[-10] -> 109.98
A30: -42.23 | B30: 9.9 | C30: 1567 | F30: =R[12]C[-3]-1033 -> 934 | G30: =R[12]C[-6]*-1 -> 47.84 | H30: =R[12]C[-6] -> 14.71 | I30: =R[75]C[-8]*-1 -> 75.11 | J30: =R[75]C[-8] -> 56.25 | K30: =R[138]C[-10]*-1 -> 83.57 | L30: =R[138]C[-10] -> 109.24
A31: -42.23 | B31: 9.89 | C31: 1600 | F31: =R[12]C[-3]-1033 -> 967 | G31: =R[12]C[-6]*-1 -> 49.2 | H31: =R[12]C[-6] -> 16.41 | I31: =R[75]C[-8]*-1 -> 79.44 | J31: =R[75]C[-8] -> 56.6 | K31: =R[138]C[-10]*-1 -> 88.04 | L31: =R[138]C[-10] -> 109.59
A32: -42.23 | B32: 9.89 | C32: 1633 | F32: =R[12]C[-3]-1033 -> 1000 | G32: =R[12]C[-6]*-1 -> 51.13 | H32: =R[12]C[-6] -> 19.260000000000002 | I32: =R[75]C[-8]*-1 -> 83.89 | J32: =R[75]C[-8] -> 57.32 | K32: =R[138]C[-10]*-1 -> 91.41 | L32: =R[138]C[-10] -> 110.23
A33: -42.91 | B33: 9.89 | C33: 1667 | F33: =R[12]C[-3]-1033 -> 1034 | G33: =R[12]C[-6]*-1 -> 52.84 | H33: =R[12]C[-6] -> 19.59 | I33: =R[75]C[-8]*-1 -> 89.44 | J33: =R[75]C[-8] -> 56.62 | K33: =R[138]C[-10]*-1 -> 95.52 | L33: =R[138]C[-10] -> 110.52
A34: -43.26 | B34: 9.89 | C34: 1700 | F34: =R[12]C[-3]-1033 -> 1067 | G34: =R[12]C[-6]*-1 -> 58 | H34: =R[12]C[-6] -> 22.26 | I34: =R[75]C[-8]*-1 -> 96.45 | J34: =R[75]C[-8] -> 56.36 | K34: =R[138]C[-10]*-1 -> 99.26 | L34: =R[138]C[-10] -> 110.82
A35: -43.59 | B35: 9.5399999999999991 | C35: 1733 | F35: =R[12]C[-3]-1033 -> 1100 | G35: =R[12]C[-6]*-1 -> 63.54 | H35: =R[12]C[-6] -> 24.91 | I35: =R[75]C[-8]*-1 -> 102.74 | J35: =R[75]C[-8] -> 56.47 | K35: =R[138]C[-10]*-1 -> 102.26 | L35: =R[138]C[-10] -> 111.15
A36: -43.6 | B36: 9.5399999999999991 | C36: 1767 | F36: =R[12]C[-3]-1033 -> 1134 | G36: =R[12]C[-6]*-1 -> 69.06 | H36: =R[12]C[-6] -> 26.72 | I36: =R[75]C[-8]*-1 -> 109.76 | J36: =R[75]C[-8] -> 56.55 | K36: =R[138]C[-10]*-1 -> 106.36 | L36: =R[138]C[-10] -> 111.47
A37: -43.6 | B37: 9.5500000000000007 | C37: 1800 | F37: =R[12]C[-3]-1033 -> 1167 | G37: =R[12]C[-6]*-1 -> 75.67 | H37: =R[12]C[-6] -> 27.06 | I37: =R[75]C[-8]*-1 -> 117.52 | J37: =R[75]C[-8] -> 58.8 | K37: =R[138]C[-10]*-1 -> 108.83 | L37: =R[138]C[-10] -> 112.14
A38: -43.94 | B38: 9.8800000000000008 | C38: 1833 | F38: =R[12]C[-3]-1033 -> 1200 | G38: =R[12]C[-6]*-1 -> 82.28 | H38: =R[12]C[-6] -> 27.03 | I38: =R[75]C[-8]*-1 -> 124.17 | J38: =R[75]C[-8] -> 59.64 | K38: =R[138]C[-10]*-1 -> 111.47 | L38: =R[138]C[-10] -> 113.55
A39: -44.28 | B39: 10.56 | C39: 1867 | F39: =R[12]C[-3]-1033 -> 1234 | G39: =R[12]C[-6]*-1 -> 89.99 | H39: =R[12]C[-6] -> 25.9 | I39: =R[75]C[-8]*-1 -> 129.72999999999999 | J39: =R[75]C[-8] -> 61.87 | K39: =R[138]C[-10]*-1 -> 114.33 | L39: =R[138]C[-10] -> 113.2
A40: -44.62 | B40: 11.24 | C40: 1900 | F40: =R[12]C[-3]-1033 -> 1267 | G40: =R[12]C[-6]*-1 -> 98.43 | H40: =R[12]C[-6] -> 22.93 | I40: =R[75]C[-8]*-1 -> 135.28 | J40: =R[75]C[-8] -> 62.32 | K40: =R[138]C[-10]*-1 -> 116.6 | L40: =R[138]C[-10] -> 113.55
A41: -46.81 | B41: 13.35 | C41: 1933 | F41: =R[12]C[-3]-1033 -> 1300 | G41: =R[12]C[-6]*-1 -> 107.6 | H41: =R[12]C[-6] -> 19.579999999999998 | I41: =R[75]C[-8]*-1 -> 138.63 | J41: =R[75]C[-8] -> 63.72 | K41: =R[138]C[-10]*-1 -> 119.6 | L41: =R[138]C[-10] -> 113.88
A42: -47.84 | B42: 14.71 | C42: 1967 | F42: =R[12]C[-3]-1033 -> 1334 | G42: =R[12]C[-6]*-1 -> 117.14 | H42: =R[12]C[-6] -> 16.61 | I42: =R[75]C[-8]*-1 -> 142.72 | J42: =R[75]C[-8] -> 65.52 | K42: =R[138]C[-10]*-1 -> 121.8 | L42: =R[138]C[-10] -> 113.56
A43: -49.2 | B43: 16.41 | C43: 2000 | F43: =R[12]C[-3]-1033 -> 1367 | G43: =R[12]C[-6]*-1 -> 126.31 | H43: =R[12]C[-6] -> 12.9 | I43: =R[75]C[-8]*-1 -> 144.6 | J43: =R[75]C[-8] -> 65.849999999999994 | K43: =R[138]C[-10]*-1 -> 123.33 | L43: =R[138]C[-10] -> 113.55
A44: -51.13 | B44: 19.260000000000002 | C44: 2033 | F44: =R[12]C[-3]-1033 -> 1400 | G44: =R[12]C[-6]*-1 -> 135.97999999999999 | H44: =R[12]C[-6] -> 11.3 | I44: =R[75]C[-8]*-1 -> 147.94 | J44: =R[75]C[-8] -> 65.489999999999995 | K44: =R[138]C[-10]*-1 -> 126.71 | L44: =R[138]C[-10] -> 113.91
A45: -52.84 | B45: 19.59 | C45: 2067 | F45: =R[12]C[-3]-1033 -> 1434 | G45: =R[12]C[-6]*-1 -> 145.9 | H45: =R[12]C[-6] -> 9.7899999999999991 | I45: =R[75]C[-8]*-1 -> 149.81 | J45: =R[75]C[-8] -> 65.14 | K45: =R[138]C[-10]*-1 -> 128.24 | L45: =R[138]C[-10] -> 113.9
A46: -58 | B46: 22.26 | C46: 2100 | F46: =R[12]C[-3]-1033 -> 1467 | G46: =R[12]C[-6]*-1 -> 152.88 | H46: =R[12]C[-6] -> 9.76 | I46: =R[75]C[-8]*-1 -> 151.68 | J46: =R[75]C[-8] -> 64.12 | K46: =R[138]C[-10]*-1 -> 131.46 | L46: =R[138]C[-10] -> 113.09
A47: -63.54 | B47: 24.91 | C47: 2133 | F47: =R[12]C[-3]-1033 -> 1500 | G47: =R[12]C[-6]*-1 -> 159.52000000000001 | H47: =R[12]C[-6] -> 9.7899999999999991 | I47: =R[75]C[-8]*-1 -> 153.38 | J47: =R[75]C[-8] -> 63.43 | K47: =R[138]C[-10]*-1 -> 133.72999999999999 | L47: =R[138]C[-10] -> 112.76
A48: -69.06 | B48: 26.72 | C48: 2167 | F48: =R[12]C[-3]-1033 -> 1534 | G48: =R[12]C[-6]*-1 -> 164.92 | H48: =R[12]C[-6] -> 9.1199999999999992 | I48: =R[75]C[-8]*-1 -> 155.08000000000001 | J48: =R[75]C[-8] -> 63.08 | K48: =R[138]C[-10]*-1 -> 137.09 | L48: =R[138]C[-10] -> 111.59
A49: -75.67 | B49: 27.06 | C49: 2200 | F49: =R[12]C[-3]-1033 -> 1567 | G49: =R[12]C[-6]*-1 -> 167.13 | H49: =R[12]C[-6] -> 8.77 | I49: =R[75]C[-8]*-1 -> 156.94999999999999 | J49: =R[75]C[-8] -> 62.39 | K49: =R[138]C[-10]*-1 -> 140.83000000000001 | L49: =R[138]C[-10] -> 111.68
A50: -82.28 | B50: 27.03 | C50: 2233 | F50: =R[12]C[-3]-1033 -> 1600 | G50: =R[12]C[-6]*-1 -> 168.15 | H50: =R[12]C[-6] -> 7.74 | I50: =R[75]C[-8]*-1 -> 158.82 | J50: =R[75]C[-8] -> 61.71 | K50: =R[138]C[-10]*-1 -> 143.1 | L50: =R[138]C[-10] -> 112.43
A51: -89.99 | B51: 25.9 | C51: 2267 | F51: =R[12]C[-3]-1033 -> 1634 | G51: =R[12]C[-6]*-1 -> 168.15 | H51: =R[12]C[-6] -> 7.06 | I51: =R[75]C[-8]*-1 -> 162.16 | J51: =R[75]C[-8] -> 60.25 | K51: =R[138]C[-10]*-1 -> 146.74 | L51: =R[138]C[-10] -> 110.69
A52: -98.43 | B52: 22.93 | C52: 2300 | F52: =R[12]C[-3]-1033 -> 1667 | G52: =R[12]C[-6]*-1 -> 169.85 | H52: =R[12]C[-6] -> 7.05 | I52: =R[75]C[-8]*-1 -> 164.03 | J52: =R[75]C[-8] -> 60.24 | K52: =R[138]C[-10]*-1 -> 149.31 | L52: =R[138]C[-10] -> 111.15
A53: -107.6 | B53: 19.579999999999998 | C53: 2333 | F53: =R[12]C[-3]-1033 -> 1700 | G53: =R[12]C[-6]*-1 -> 170.87 | H53: =R[12]C[-6] -> 6.37 | I53: =R[75]C[-8]*-1 -> 165.91 | J53: =R[75]C[-8] -> 60.57 | K53: =R[138]C[-10]*-1 -> 153.05000000000001 | L53: =R[138]C[-10] -> 112.86
A54: -117.14 | B54: 16.61 | C54: 2367 | F54: =R[12]C[-3]-1033 -> 1734 | G54: =R[12]C[-6]*-1 -> 171.89 | H54: =R[12]C[-6] -> 6.36 | I54: =R[75]C[-8]*-1 -> 167.78 | J54: =R[75]C[-8] -> 60.23 | K54: =R[138]C[-10]*-1 -> 154.59 | L54: =R[138]C[-10] -> 113.88
A55: -126.31 | B55: 12.9 | C55: 2400 | F55: =R[12]C[-3]-1033 -> 1767 | G55: =R[12]C[-6]*-1 -> 172.57 | H55: =R[12]C[-6] -> 6.02 | I55: =R[75]C[-8]*-1 -> 169.66 | J55: =R[75]C[-8] -> 60.22 | K55: =R[138]C[-10]*-1 -> 156.12 | L55: =R[138]C[-10] -> 113.87
A56: -135.97999999999999 | B56: 11.3 | C56: 2433 | F56: =R[12]C[-3]-1033 -> 1800 | G56: =R[12]C[-6]*-1 -> 172.57 | H56: =R[12]C[-6] -> 6.36 | I56: =R[75]C[-8]*-1 -> 171.54 | J56: =R[75]C[-8] -> 59.53 | K56: =R[138]C[-10]*-1 -> 161.33000000000001 | L56: =R[138]C[-10] -> 112.32
A57: -145.9 | B57: 9.7899999999999991 | C57: 2467 | F57: =R[12]C[-3]-1033 -> 1834 | G57: =R[12]C[-6]*-1 -> 173.25 | H57: =R[12]C[-6] -> 6.36 | I57: =R[75]C[-8]*-1 -> 173.41 | J57: =R[75]C[-8] -> 59.18 | K57: =R[138]C[-10]*-1 -> 162.86000000000001 | L57: =R[138]C[-10] -> 112.99
A58: -152.88 | B58: 9.76 | C58: 2500 | F58: =R[12]C[-3]-1033 -> 1867 | G58: =R[12]C[-6]*-1 -> 173.25 | H58: =R[12]C[-6] -> 6.36 | I58: =R[75]C[-8]*-1 -> 175.29 | J58: =R[75]C[-8] -> 59.17 | K58: =R[138]C[-10]*-1 -> 164.4 | L58: =R[138]C[-10] -> 113.32
A59: -159.52000000000001 | B59: 9.7899999999999991 | C59: 2533 | F59: =R[12]C[-3]-1033 -> 1900 | G59: =R[12]C[-6]*-1 -> 173.25 | H59: =R[12]C[-6] -> 6.36 | I59: =R[75]C[-8]*-1 -> 177.16 | J59: =R[75]C[-8] -> 58.49 | K59: =R[138]C[-10]*-1 -> 165.94 | L59: =R[138]C[-10] -> 113.66
A60: -164.92 | B60: 9.1199999999999992 | C60: 2567
A61: -167.13 | B61: 8.77 | C61: 2600
A62: -168.15 | B62: 7.74 | C62: 2633
A63: -168.15 | B63: 7.06 | C63: 2667
A64: -169.85 | B64: 7.05 | C64: 2700
A65: -170.87 | B65: 6.37 | C65: 2733
A66: -171.89 | B66: 6.36 | C66: 2767
A67: -172.57 | B67: 6.02 | C67: 2800
A68: -172.57 | B68: 6.36 | C68: 2833
A69: -173.25 | B69: 6.36 | C69: 2867
A70: -173.25 | B70: 6.36 | C70: 2900
A71: -173.25 | B71: 6.36 | C71: 2933
A73: Track
A74: Label : | B74: Rodilla
A75: Coords (x,y:cm; t:time)
A76: x | B76: y | C76: t
A77: -24.13 | B77: 61.42 | C77: 1033
A78: -26.73 | B78: 61.09 | C78: 1067
A79: -28.61 | B79: 61.09 | C79: 1100
A80: -29.63 | B80: 61.08 | C80: 1133
A81: -33.340000000000003 | B81: 61.78 | C81: 1167
A82: -35.21 | B82: 61.43 | C82: 1200
A83: -37.44 | B83: 61.92 | C83: 1233
A84: -39.14 | B84: 61.57 | C84: 1267
A85: -41.02 | B85: 61.56 | C85: 1300
A86: -42.04 | B86: 61.22 | C86: 1333
A87: -43.74 | B87: 61.21 | C87: 1367
A88: -44.76 | B88: 61.21 | C88: 1400
A89: -46.28 | B89: 60.88 | C89: 1433
A90: -47.31 | B90: 60.87 | C90: 1467
A91: -48.67 | B91: 60.53 | C91: 1500
A92: -48.95 | B92: 61.06 | C92: 1533
A93: -50.31 | B93: 60.71 | C93: 1567
A94: -51.68 | B94: 60.37 | C94: 1600
A95: -53.04 | B95: 60.02 | C95: 1633
A96: -54.4 | B96: 59.67 | C96: 1667
A97: -56.1 | B97: 58.99 | C97: 1700
A98: -57.97 | B98: 58.64 | C98: 1733
A99: -59.84 | B99: 57.95 | C99: 1767
A100: -61.71 | B100: 57.26 | C100: 1800
A101: -63.58 | B101: 56.57 | C101: 1833
A102: -65.45 | B102: 55.88 | C102: 1867
A103: -69.16 | B103: 55.72 | C103: 1900
A104: -71.03 | B104: 55.53 | C104: 1933
A105: -75.11 | B105: 56.25 | C105: 1967
A106: -79.44 | B106: 56.6 | C106: 2000
A107: -83.89 | B107: 57.32 | C107: 2033
A108: -89.44 | B108: 56.62 | C108: 2067
A109: -96.45 | B109: 56.36 | C109: 2100
A110: -102.74 | B110: 56.47 | C110: 2133
A111: -109.76 | B111: 56.55 | C111: 2167
A112: -117.52 | B112: 58.8 | C112: 2200
A113: -124.17 | B113: 59.64 | C113: 2233
A114: -129.72999999999999 | B114: 61.87 | C114: 2267
A115: -135.28 | B115: 62.32 | C115: 2300
A116: -138.63 | B116: 63.72 | C116: 2333
A117: -142.72 | B117: 65.52 | C117: 2367
A118: -144.6 | B118: 65.849999999999994 | C118: 2400
A119: -147.94 | B119: 65.489999999999995 | C119: 2433
A120: -149.81 | B120: 65.14 | C120: 2467
A121: -151.68 | B121: 64.12 | C121: 2500
A122: -153.38 | B122: 63.43 | C122: 2533
A123: -155.08000000000001 | B123: 63.08 | C123: 2567
A124: -156.94999999999999 | B124: 62.39 | C124: 2600
A125: -158.82 | B125: 61.71 | C125: 2633
A126: -162.16 | B126: 60.25 | C126: 2667
A127: -164.03 | B127: 60.24 | C127: 2700
A128: -165.91 | B128: 60.57 | C128: 2733
A129: -167.78 | B129: 60.23 | C129: 2767
A130: -169.66 | B130: 60.22 | C130: 2800
A131: -171.54 | B131: 59.53 | C131: 2833
A132: -173.41 | B132: 59.18 | C132: 2867
A133: -175.29 | B133: 59.17 | C133: 2900
A134: -177.16 | B134: 58.49 | C134: 2933
A136: Track
A137: Label : | B137: Cadera
A138: Coords (x,y:cm; t:time)
A139: x | B139: y | C139: t
A140: -4.3099999999999996 | B140: 108.74 | C140: 1033
A141: -6.04 | B141: 109.49 | C141: 1067
A142: -8.9499999999999993 | B142: 111.03 | C142: 1100
A143: -8.9499999999999993 | B143: 111.37 | C143: 1133
A144: -12.96 | B144: 111.8 | C144: 1167
A145: -16.53 | B145: 112.23 | C145: 1200
A146: -19.59 | B146: 114.48 | C146: 1233
A147: -23.6 | B147: 114.55 | C147: 1267
A148: -26.61 | B148: 115.2 | C148: 1300
A149: -29.21 | B149: 115.98 | C149: 1333
A150: -32.15 | B150: 116.36 | C150: 1367
A151: -34.75 | B151: 116.78 | C151: 1400
A152: -37.380000000000003 | B152: 116.76 | C152: 1433
A153: -39.65 | B153: 116.75 | C153: 1467
A154: -43.02 | B154: 116.4 | C154: 1500
A155: -44.55 | B155: 116.39 | C155: 1533
A156: -47.55 | B156: 115.7 | C156: 1567
A157: -50.18 | B157: 115.35 | C157: 1600
A158: -53.55 | B158: 114.99 | C158: 1633
A159: -55.08 | B159: 114.99 | C159: 1667
A160: -57.54 | B160: 113.11 | C160: 1700
A161: -61.27 | B161: 112.76 | C161: 1733
A162: -64.64 | B162: 112.38 | C162: 1767
A163: -66.73 | B163: 112.03 | C163: 1800
A164: -70.099999999999994 | B164: 111.33 | C164: 1833
A165: -73.459999999999994 | B165: 110.3 | C165: 1867
A166: -76.459999999999994 | B166: 109.61 | C166: 1900
A167: -80.2 | B167: 109.98 | C167: 1933
A168: -83.57 | B168: 109.24 | C168: 1967
A169: -88.04 | B169: 109.59 | C169: 2000
A170: -91.41 | B170: 110.23 | C170: 2033
A171: -95.52 | B171: 110.52 | C171: 2067
A172: -99.26 | B172: 110.82 | C172: 2100
A173: -102.26 | B173: 111.15 | C173: 2133
A174: -106.36 | B174: 111.47 | C174: 2167
A175: -108.83 | B175: 112.14 | C175: 2200
A176: -111.47 | B176: 113.55 | C176: 2233
A177: -114.33 | B177: 113.2 | C177: 2267
A178: -116.6 | B178: 113.55 | C178: 2300
A179: -119.6 | B179: 113.88 | C179: 2333
A180: -121.8 | B180: 113.56 | C180: 2367
A181: -123.33 | B181: 113.55 | C181: 2400
A182: -126.71 | B182: 113.91 | C182: 2433
A183: -128.24 | B183: 113.9 | C183: 2467
A184: -131.46 | B184: 113.09 | C184: 2500
A185: -133.72999999999999 | B185: 112.76 | C185: 2533
A186: -137.09 | B186: 111.59 | C186: 2567
A187: -140.83000000000001 | B187: 111.68 | C187: 2600
A188: -143.1 | B188: 112.43 | C188: 2633
A189: -146.74 | B189: 110.69 | C189: 2667
A190: -149.31 | B190: 111.15 | C190: 2700
A191: -153.05000000000001 | B191: 112.86 | C191: 2733
A192: -154.59 | B192: 113.88 | C192: 2767
A193: -156.12 | B193: 113.87 | C193: 2800
A194: -161.33000000000001 | B194: 112.32 | C194: 2833
A195: -162.86000000000001 | B195: 112.99 | C195: 2867
A196: -164.4 | B196: 113.32 | C196: 2900
A197: -165.94 | B197: 113.66 | C197: 2933